{"$schema":"https://json-schema.org/draft/2020-12/schema","$id":"urn:bildr:harness.supervisor-snapshot.v1","title":"BILDR supervisor snapshot v1","type":"object","additionalProperties":false,"required":["schema","snapshot_id","run_id","revision","generated_at","event_cursor","base_sha","profile_id","plan_digest","goal_revision","trigger","goal","run","tasks","agents","budgets","allowed_actions","evidence_refs","prior_decision","expert_consultations","operator_control"],"properties":{"schema":{"const":"harness.supervisor-snapshot.v1"},"snapshot_id":{"type":"string","minLength":1,"maxLength":128,"pattern":"^[A-Za-z0-9._:-]+$"},"run_id":{"type":"string","minLength":1,"maxLength":160,"pattern":"^[A-Za-z0-9._:-]+$"},"revision":{"type":"integer","minimum":1},"generated_at":{"type":"string","format":"date-time"},"event_cursor":{"type":"integer","minimum":0},"base_sha":{"type":"string","pattern":"^[0-9a-f]{40}$"},"profile_id":{"type":"string","minLength":1,"maxLength":128,"pattern":"^[A-Za-z0-9._:-]+$"},"plan_digest":{"type":"string","pattern":"^[0-9a-f]{64}$"},"goal_revision":{"type":"integer","minimum":1},"trigger":{"$ref":"#/$defs/trigger"},"goal":{"$ref":"#/$defs/goal"},"run":{"$ref":"#/$defs/run"},"tasks":{"type":"array","maxItems":100,"items":{"$ref":"#/$defs/task"}},"agents":{"type":"array","maxItems":100,"items":{"$ref":"#/$defs/agent"}},"budgets":{"$ref":"#/$defs/budgets"},"allowed_actions":{"type":"array","minItems":1,"maxItems":16,"uniqueItems":true,"items":{"$ref":"#/$defs/actionKind"}},"evidence_refs":{"type":"array","maxItems":200,"items":{"$ref":"#/$defs/evidenceRef"}},"prior_decision":{"type":["object","null"]},"expert_consultations":{"type":"array","maxItems":20,"items":{"$ref":"#/$defs/expert"}},"operator_control":{"$ref":"#/$defs/operatorControl"}},"$defs":{"actionKind":{"type":"string","enum":["wait","continue_attempt","steer_active_turn","start_followup_turn","retry_fresh_attempt","spawn_explorer","spawn_reviewer","reroute_attempt","request_expert","request_replan","request_verification","queue_integration","cancel_attempt","pause_for_human","stop_run"]},"evidenceRef":{"type":"object","additionalProperties":false,"required":["kind","id","summary"],"properties":{"kind":{"type":"string","enum":["command","validation","artifact","finding","diff","commit","context","goal","agent_message","expert_response","event"]},"id":{"type":"string","minLength":1,"maxLength":128,"pattern":"^[A-Za-z0-9._:-]+$"},"digest":{"anyOf":[{"type":"string","pattern":"^[0-9a-f]{64}$"},{"type":"null"}]},"summary":{"type":"string","minLength":1,"maxLength":1000}}},"trigger":{"type":"object","additionalProperties":false,"required":["kind","occurred_at","event_ids","coalesced_count"],"properties":{"kind":{"type":"string","enum":["run_execution_started","goal_revision_changed","task_needs_help","task_stalled","attempt_failed","attempt_interrupted","agent_completed","candidate_materialized","validation_completed","verifier_completed","integration_conflict","dependency_unblocked","expert_completed","expert_failed","operator_steered","budget_boundary_crossed","no_progress_boundary_crossed","scheduled_liveness_review","recovery"]},"occurred_at":{"type":"string","format":"date-time"},"event_ids":{"type":"array","minItems":1,"maxItems":100,"uniqueItems":true,"items":{"type":"string","minLength":1,"maxLength":128,"pattern":"^[A-Za-z0-9._:-]+$"}},"coalesced_count":{"type":"integer","minimum":1,"maximum":100}}},"goal":{"type":"object","additionalProperties":false,"required":["original_objective","refined_objective","status","hard_constraints","non_goals","success_criteria","milestones","critical_path_task_ids"],"properties":{"original_objective":{"type":"string","minLength":1,"maxLength":12000},"refined_objective":{"type":"string","minLength":1,"maxLength":12000},"status":{"type":"string","enum":["active","blocked","verification","human_review","terminal"]},"hard_constraints":{"type":"array","maxItems":100,"items":{"type":"string","minLength":1,"maxLength":2000}},"non_goals":{"type":"array","maxItems":100,"items":{"type":"string","minLength":1,"maxLength":2000}},"success_criteria":{"type":"array","minItems":1,"maxItems":100,"items":{"type":"object","additionalProperties":false,"required":["id","statement","state","evidence_refs"],"properties":{"id":{"type":"string","minLength":1,"maxLength":128,"pattern":"^[A-Za-z0-9._:-]+$"},"statement":{"type":"string","minLength":1,"maxLength":2000},"state":{"type":"string","enum":["unstarted","in_progress","proven","failed","inconclusive"]},"evidence_refs":{"type":"array","maxItems":20,"items":{"$ref":"#/$defs/evidenceRef"}}}}},"milestones":{"type":"array","minItems":1,"maxItems":100,"items":{"type":"object","additionalProperties":false,"required":["id","title","state","critical_path","task_ids"],"properties":{"id":{"type":"string","minLength":1,"maxLength":128,"pattern":"^[A-Za-z0-9._:-]+$"},"title":{"type":"string","minLength":1,"maxLength":500},"state":{"type":"string","enum":["pending","in_progress","completed","blocked"]},"critical_path":{"type":"boolean"},"task_ids":{"type":"array","maxItems":50,"uniqueItems":true,"items":{"type":"string","minLength":1,"maxLength":128,"pattern":"^[A-Za-z0-9._:-]+$"}}}}},"critical_path_task_ids":{"type":"array","maxItems":100,"uniqueItems":true,"items":{"type":"string","minLength":1,"maxLength":128,"pattern":"^[A-Za-z0-9._:-]+$"}}}},"run":{"type":"object","additionalProperties":false,"required":["state","phase","elapsed_seconds","last_material_progress_at","ready_task_ids","blocked_task_ids","active_task_ids","completion_candidate"],"properties":{"state":{"type":"string","minLength":1,"maxLength":64},"phase":{"type":"string","minLength":1,"maxLength":128},"elapsed_seconds":{"type":"integer","minimum":0},"last_material_progress_at":{"type":["string","null"],"format":"date-time"},"ready_task_ids":{"type":"array","maxItems":100,"uniqueItems":true,"items":{"type":"string","minLength":1,"maxLength":128,"pattern":"^[A-Za-z0-9._:-]+$"}},"blocked_task_ids":{"type":"array","maxItems":100,"uniqueItems":true,"items":{"type":"string","minLength":1,"maxLength":128,"pattern":"^[A-Za-z0-9._:-]+$"}},"active_task_ids":{"type":"array","maxItems":100,"uniqueItems":true,"items":{"type":"string","minLength":1,"maxLength":128,"pattern":"^[A-Za-z0-9._:-]+$"}},"completion_candidate":{"type":"boolean"}}},"progress":{"type":"object","additionalProperties":false,"required":["milestones_completed","milestones_total","criteria_proven","criteria_total","candidate_materialized","validations_passed","validations_failed","blocking_findings","material_progress_sequence","last_material_progress_at"],"properties":{"milestones_completed":{"type":"integer","minimum":0},"milestones_total":{"type":"integer","minimum":0},"criteria_proven":{"type":"integer","minimum":0},"criteria_total":{"type":"integer","minimum":0},"candidate_materialized":{"type":"boolean"},"validations_passed":{"type":"integer","minimum":0},"validations_failed":{"type":"integer","minimum":0},"blocking_findings":{"type":"integer","minimum":0},"material_progress_sequence":{"type":"integer","minimum":0},"last_material_progress_at":{"type":["string","null"],"format":"date-time"}}},"efficiency":{"type":"object","additionalProperties":false,"required":["class","tokens_total","tokens_since_material_progress","material_progress_events","semantic_repeat_count","tool_calls","tool_failures","active_seconds","externally_blocked_seconds","baseline_sample_size","policy_version","reason_codes"],"properties":{"class":{"type":"string","enum":["unknown","healthy","watch","degraded","stalled"]},"tokens_total":{"type":"integer","minimum":0},"tokens_since_material_progress":{"type":"integer","minimum":0},"material_progress_events":{"type":"integer","minimum":0},"semantic_repeat_count":{"type":"integer","minimum":0},"tool_calls":{"type":"integer","minimum":0},"tool_failures":{"type":"integer","minimum":0},"active_seconds":{"type":"integer","minimum":0},"externally_blocked_seconds":{"type":"integer","minimum":0},"baseline_sample_size":{"type":"integer","minimum":0},"policy_version":{"type":"string","minLength":1,"maxLength":64},"reason_codes":{"type":"array","maxItems":20,"uniqueItems":true,"items":{"type":"string","minLength":1,"maxLength":128}}}},"task":{"type":"object","additionalProperties":false,"required":["task_id","title","state","priority","risk_flags","objective","depends_on","current_attempt_id","retry_count","same_failure_repetitions","progress","efficiency","blockers","evidence_refs"],"properties":{"task_id":{"type":"string","minLength":1,"maxLength":128,"pattern":"^[A-Za-z0-9._:-]+$"},"title":{"type":"string","minLength":1,"maxLength":500},"state":{"type":"string","minLength":1,"maxLength":64},"priority":{"type":"integer","minimum":0,"maximum":1000},"risk_flags":{"type":"array","maxItems":50,"uniqueItems":true,"items":{"type":"string","minLength":1,"maxLength":128}},"objective":{"type":"string","minLength":1,"maxLength":4000},"depends_on":{"type":"array","maxItems":100,"uniqueItems":true,"items":{"type":"string","minLength":1,"maxLength":128,"pattern":"^[A-Za-z0-9._:-]+$"}},"current_attempt_id":{"anyOf":[{"type":"string","minLength":1,"maxLength":160,"pattern":"^[A-Za-z0-9._:-]+$"},{"type":"null"}]},"retry_count":{"type":"integer","minimum":0},"same_failure_repetitions":{"type":"integer","minimum":0},"progress":{"$ref":"#/$defs/progress"},"efficiency":{"$ref":"#/$defs/efficiency"},"blockers":{"type":"array","maxItems":20,"items":{"type":"string","minLength":1,"maxLength":1000}},"evidence_refs":{"type":"array","maxItems":50,"items":{"$ref":"#/$defs/evidenceRef"}}}},"agent":{"type":"object","additionalProperties":false,"required":["session_id","role","task_id","attempt_id","state","requested_model","effective_model","requested_effort","effective_effort","current_goal","help_requested","efficiency"],"properties":{"session_id":{"type":"string","minLength":1,"maxLength":128,"pattern":"^[A-Za-z0-9._:-]+$"},"role":{"type":"string","minLength":1,"maxLength":64},"task_id":{"anyOf":[{"type":"string","minLength":1,"maxLength":128,"pattern":"^[A-Za-z0-9._:-]+$"},{"type":"null"}]},"attempt_id":{"anyOf":[{"type":"string","minLength":1,"maxLength":160,"pattern":"^[A-Za-z0-9._:-]+$"},{"type":"null"}]},"state":{"type":"string","enum":["queued","active","waiting","idle","completed","failed","interrupted"]},"requested_model":{"type":"string","minLength":1,"maxLength":128},"effective_model":{"type":"string","minLength":1,"maxLength":128},"requested_effort":{"type":"string","enum":["none","low","medium","high","xhigh","max"]},"effective_effort":{"type":"string","enum":["none","low","medium","high","xhigh","max"]},"current_goal":{"type":"string","minLength":1,"maxLength":4000},"help_requested":{"type":"boolean"},"efficiency":{"$ref":"#/$defs/efficiency"}}},"budgets":{"type":"object","additionalProperties":false,"required":["run_tokens_used","run_tokens_remaining","supervisor_tokens_used","supervisor_token_budget_per_request","expert_tokens_used","expert_token_budget_per_request","expert_completed_cap_per_signature","active_expert_requests","active_thread_count","max_thread_count"],"properties":{"run_tokens_used":{"type":"integer","minimum":0},"run_tokens_remaining":{"type":"integer","minimum":0},"supervisor_tokens_used":{"type":"integer","minimum":0},"supervisor_token_budget_per_request":{"type":"integer","minimum":1},"expert_tokens_used":{"type":"integer","minimum":0},"expert_token_budget_per_request":{"type":"integer","minimum":1},"expert_completed_cap_per_signature":{"type":"integer","minimum":1,"maximum":2},"active_expert_requests":{"type":"integer","minimum":0,"maximum":20},"active_thread_count":{"type":"integer","minimum":0},"max_thread_count":{"type":"integer","minimum":1}}},"expert":{"type":"object","additionalProperties":false,"required":["request_id","action_id","category","state","requested_model","requested_effort","escalation_signature","response"],"properties":{"request_id":{"type":"string","minLength":1,"maxLength":128,"pattern":"^[A-Za-z0-9._:-]+$"},"action_id":{"type":"string","minLength":1,"maxLength":128,"pattern":"^[A-Za-z0-9._:-]+$"},"category":{"type":"string","enum":["architecture","contract","data","integration","repeated_failure","disagreement","other"]},"state":{"type":"string","enum":["QUEUED","RUNNING","COMPLETED","FAILED","INCONCLUSIVE","CANCELED","STALE"]},"requested_model":{"const":"gpt-5.6-sol"},"requested_effort":{"const":"xhigh"},"escalation_signature":{"type":"string","pattern":"^[0-9a-f]{64}$"},"response":{"anyOf":[{"type":"null"},{"type":"object","additionalProperties":false,"required":["id","payload_sha256","verdict","summary","recommendation","evidence_refs"],"properties":{"id":{"type":"string","minLength":1,"maxLength":128,"pattern":"^[A-Za-z0-9._:-]+$"},"payload_sha256":{"type":"string","pattern":"^[0-9a-f]{64}$"},"verdict":{"type":"string","enum":["recommendation","insufficient_evidence","human_input_required","replan_required","no_change"]},"summary":{"type":"string","minLength":1,"maxLength":4000},"recommendation":{"type":"string","minLength":1,"maxLength":6000},"evidence_refs":{"type":"array","maxItems":100,"items":{"type":"string","minLength":1,"maxLength":128,"pattern":"^[A-Za-z0-9._:-]+$"}}}}]}}},"operatorControl":{"type":"object","additionalProperties":false,"required":["schema","snapshot_id","snapshot_revision","snapshot_sha256","event_cursor","attention","material_progress","liveness","reconciliation","investigations","external_conditions","truncated_sections","limitations"],"properties":{"schema":{"const":"harness.supervisor-control-facts.v1"},"snapshot_id":{"type":"string","minLength":1,"maxLength":128,"pattern":"^[A-Za-z0-9._:-]+$"},"snapshot_revision":{"type":"integer","minimum":1},"snapshot_sha256":{"type":"string","pattern":"^[0-9a-f]{64}$"},"event_cursor":{"type":"integer","minimum":0},"attention":{"type":"array","maxItems":50,"items":{"$ref":"#/$defs/operatorControlFact"}},"material_progress":{"type":"array","maxItems":50,"items":{"$ref":"#/$defs/operatorControlFact"}},"liveness":{"type":"array","maxItems":50,"items":{"$ref":"#/$defs/operatorControlFact"}},"reconciliation":{"type":"array","maxItems":50,"items":{"$ref":"#/$defs/operatorControlFact"}},"investigations":{"type":"array","maxItems":50,"items":{"$ref":"#/$defs/operatorControlFact"}},"external_conditions":{"type":"array","maxItems":50,"items":{"$ref":"#/$defs/operatorControlFact"}},"truncated_sections":{"type":"array","maxItems":8,"items":{"type":"object","additionalProperties":false,"required":["section","omitted_rows","limit"],"properties":{"section":{"type":"string","enum":["attention","attempts","investigations","external_conditions","progress","progress_classifier","liveness","reconciliation"]},"omitted_rows":{"type":"integer","minimum":1},"limit":{"type":"integer","minimum":1,"maximum":1000}}}},"limitations":{"type":"array","minItems":2,"maxItems":8,"items":{"type":"string","minLength":1,"maxLength":1000}}}},"operatorControlFact":{"type":"object","additionalProperties":true,"maxProperties":32,"required":["schema"],"properties":{"schema":{"type":"string","enum":["harness.attention-item.v1","harness.material-progress.v1","harness.liveness-episode.v1","harness.reconciliation-episode.v1","harness.investigation-artifact-summary.v1","harness.external-condition-summary.v1"]},"run_id":{"anyOf":[{"type":"string","minLength":1,"maxLength":160,"pattern":"^[A-Za-z0-9._:-]+$"},{"type":"null"}]}}}}}
